{
  "kind": "action",
  "id": "expression-set-label",
  "owner": "expressions",
  "summary": "Set label (expression): edits the expression's control or link keys through the expression apply operator (expression.setLabel).",
  "status": "both",
  "replaces": [
    "features/expressions/core"
  ],
  "name": "expression.setLabel",
  "target": "type:preset-expression",
  "input": {
    "type": "object",
    "properties": {
      "label": {
        "type": "string",
        "maxLength": 64
      }
    },
    "required": [
      "label"
    ],
    "additionalProperties": false
  },
  "capability": {
    "when": "An expression preset is worn by the focused V's look and the face rig is prepared.",
    "refusals": [
      {
        "code": "face-unavailable",
        "reason": "The face rig isn't ready for this installation yet."
      }
    ]
  },
  "effect": {
    "commit": "Edits the expression's control or link keys through the expression apply operator (expression.setLabel)."
  },
  "undo": "look"
}
