{
  "kind": "action",
  "id": "saved-v-import",
  "owner": "platform",
  "summary": "Import (saved v): raises the pick-file request.",
  "status": "both",
  "replaces": [
    "studio-file-operations"
  ],
  "name": "savedV.import",
  "target": "type:window",
  "input": {
    "type": "object",
    "properties": {},
    "required": [],
    "additionalProperties": false
  },
  "capability": {
    "when": "No other picker is open in the window.",
    "refusals": [
      {
        "code": "picker-busy",
        "reason": "Another file is being picked."
      },
      {
        "code": "not-ready",
        "reason": "Build needs its settings, WolvenKit and the eye plate first."
      }
    ]
  },
  "effect": {
    "raises": "request:pick-file"
  },
  "undo": "none"
}
