{
  "kind": "action",
  "id": "motion-set-idle",
  "owner": "motion",
  "summary": "Set idle (motion): sets the scene's motion key (motion.setIdle).",
  "status": "both",
  "replaces": [
    "motion-actions",
    "platform/core/transition-settings"
  ],
  "name": "motion.setIdle",
  "target": "type:scene",
  "input": {
    "type": "object",
    "properties": {
      "enabled": {
        "type": "boolean"
      },
      "view": {
        "type": "string"
      }
    },
    "required": [
      "enabled"
    ],
    "additionalProperties": false
  },
  "capability": {
    "when": "The view's scene shows a V and motion is available for her body.",
    "refusals": [
      {
        "code": "motion-unavailable",
        "reason": "The installation has no creator idle for this body."
      }
    ]
  },
  "effect": {
    "commit": "Sets the scene's motion key (motion.setIdle)."
  },
  "undo": "none"
}
