{
  "kind": "action",
  "id": "preparation-prepare",
  "owner": "preview",
  "summary": "Prepare (preview): raises the prepare-core reques.",
  "status": "both",
  "replaces": [
    "preview-preparation"
  ],
  "name": "preview.prepare",
  "target": "type:host-settings",
  "input": {
    "type": "object",
    "properties": {},
    "required": [],
    "additionalProperties": false
  },
  "capability": {
    "when": "The game folder is known.",
    "refusals": [
      {
        "code": "no-game-folder",
        "reason": "Choose your Cyberpunk 2077 folder first."
      }
    ]
  },
  "effect": {
    "raises": "request:prepare-core"
  },
  "undo": "none"
}
