{
  "kind": "action",
  "id": "character-load-save",
  "owner": "character",
  "summary": "Load save (character): edits the V's keys through the creator apply operator (character.loadSave).",
  "status": "both",
  "replaces": [
    "character-context-actions",
    "character-context"
  ],
  "name": "character.loadSave",
  "target": "type:v",
  "input": {
    "type": "object",
    "properties": {
      "value": {
        "type": "object",
        "properties": {},
        "required": []
      }
    },
    "required": [
      "value"
    ],
    "additionalProperties": false
  },
  "capability": {
    "when": "A V is focused and the installation's creator catalogue for her body is built.",
    "refusals": [
      {
        "code": "catalogue-unavailable",
        "reason": "The character creator's choices aren't ready yet."
      },
      {
        "code": "not-offered",
        "reason": "This installation doesn't offer that choice."
      }
    ]
  },
  "effect": {
    "commit": "Edits the V's keys through the creator apply operator (character.loadSave)."
  },
  "undo": "character"
}
